{
  "$schema": "https://json-schema.org/draft/2020-12/schema",
  "schema": "ctxql.p5-7-parity-applicability-matrix/v1",
  "profile": "ctxql-ontology-profile/fluree-4.2-603974fad5c13efed9d147d214d613849fb43c73/v3-supported-subset",
  "fluree_revision": "603974fad5c13efed9d147d214d613849fb43c73",
  "reasoner_inventory": "fixtures/conformance/p5_6/direct-reasoner-inventory.json",
  "rows": [
    {"family":"unqualified-min-cardinality-zero/v1","interaction":"restriction-cardinality","direct_with_without":true,"sealed_required":true},
    {"family":"qualified-min-cardinality-class-zero/v1","interaction":"restriction-cardinality-class","direct_with_without":true,"sealed_required":true},
    {"family":"qualified-min-cardinality-class-two/v1","interaction":"restriction-cardinality-class","direct_with_without":true,"sealed_required":true},
    {"family":"qualified-min-cardinality-class-three/v1","interaction":"restriction-cardinality-class","direct_with_without":true,"sealed_required":true},
    {"family":"qualified-min-cardinality-data-zero/v1","interaction":"restriction-cardinality-datatype","direct_with_without":true,"sealed_required":true},
    {"family":"qualified-exact-cardinality-class-one/v1","interaction":"restriction-cardinality-class","direct_with_without":true,"sealed_required":true},
    {"family":"qualified-exact-cardinality-class-two/v1","interaction":"restriction-cardinality-class","direct_with_without":true,"sealed_required":true},
    {"family":"qualified-exact-cardinality-data-one/v1","interaction":"restriction-cardinality-datatype","direct_with_without":true,"sealed_required":true},
    {"family":"qualified-max-cardinality-data-one/v1","interaction":"restriction-cardinality-datatype","direct_with_without":true,"sealed_required":true},
    {"family":"datatype-standalone-declaration/v1","interaction":"datatype-declaration","direct_with_without":true,"sealed_required":true},
    {"family":"datatype-union-expression/v1","interaction":"datatype-rdf-list","direct_with_without":true,"sealed_required":true},
    {"family":"datatype-decimal-inclusive-facets/v1","interaction":"datatype-facet-rdf-list","direct_with_without":true,"sealed_required":true},
    {"family":"class-disjointness-edge/v1","interaction":"class-hierarchy","direct_with_without":true,"sealed_required":true},
    {"family":"property-disjointness-edge/v1","interaction":"property-hierarchy","direct_with_without":true,"sealed_required":true}
  ],
  "omission_policy": "pairs without shared structural input are omitted; every registered family still has direct and sealed evidence"
}
